{
    "original": "CARLSON, Carl Adolf, Fabrikör, Kinna, f Kinna 17/6 78 av skom.mäst C M Andersson o Anna Nilsson, gm gymn.dir Julia Dahl. Tekn vävsk Borås 98. Verkm Sv Jaquard-väveriet Halmstad 99, Harpebols Jacquardväv Kinna 00—07. Gr fma Marks Textilfabr Kinna 08, ag dna o Kinna Ändagården Kinna s :n. Ordf Kinna byggn.md f utomplansomr, v. ordf komm.st, led kyrkoflm, kyrkoråd, komm.nmd, barnav.nmd. Styr.led N Marks Egnahems AB Kinna. Resor: Tyskl 02, 04, 27, 29, 30, 31, 32, 33, 34, 35, 36, 37, 38, 39, 41, Österr 27, 31, 34, Frankr 27, 30, 33, 38, 39, Schweiz 27, 30, 31, 33, 36, 37, 38, 39, Belg 27, 29, Holl 29, Ital 27, 31, 33, 35, 36, 37, 38, 39, Tjeckoslov 27, 32, 34, Ung 27, 29, 34, Jugoslav 34, Bulg 34, Rumän 34, Engl 33, 38, Span 36, Kanarieö :a 38, Port 38, Madeira 38, Egypt 35, Libyen 37, Tunisien 27, 36, 38, 39, Algeriet 27, 36, 38, Marocko 36, 38, Palestina 35, Syrien 35, Norge, Danm, Finl. Odd Fellow. Hobby: Resor.",
    "translated": "CARLSON, Carl Adolf, Manufacturer, Kinna, b. Kinna 17/6 1878, son of shoemaker C M Andersson and Anna Nilsson, m. gymnastics director Julia Dahl. Technical weaving school in Borås 1898. Employed at Sv Jaquard-väveriet in Halmstad 1899, Harpebols Jacquardväv in Kinna 1900-1907. Founded and managed Marks Textilfabr in Kinna 1908, as well as owned and managed Kinna Ändagården in Kinna district. Chairman of Kinna building committee for outdoor areas, vice chairman of the municipal board, member of church council, municipal board, and child welfare committee. Board member of N Marks Egnahems AB in Kinna. Travelled to Germany in 1902, 1904, 1927, 1929, 1930, 1931, 1932, 1933, 1934, 1935, 1936, 1937, 1938, 1939, 1941, Austria in 1927, 1931, 1934, France in 1927, 1930, 1933, 1938, 1939, Switzerland in 1927, 1930, 1931, 1933, 1936, 1937, 1938, 1939, Belgium in 1927, 1929, The Netherlands in 1929, Italy in 1927, 1931, 1933, 1935, 1936, 1937, 1938, 1939, Czechoslovakia in 1927, 1932, 1934, Hungary in 1927, 1929, 1934, Yugoslavia in 1934, Bulgaria in 1934, Romania in 1934, England in 1933, 1938, Spain in 1936, Canary Islands in 1938, Portugal in 1938, Madeira in 1938, Egypt in 1935, Libya in 1937, Tunisia in 1927, 1936, 1938, 1939, Algeria in 1927, 1936, 1938, Morocco in 1936, 1938, Palestine in 1935, Syria in 1935, Norway, Denmark, Finland. Member of the Odd Fellows. Hobby: Travelling.",
    "structured": {
        "@context": "https://schema.org",
        "@type": "Person",
        "name": "Carl Adolf Carlson",
        "birthDate": "1878-06-17",
        "birthPlace": "Kinna",
        "father": {
            "@type": "Person",
            "name": "C M Andersson"
        },
        "mother": {
            "@type": "Person",
            "name": "Anna Nilsson"
        },
        "spouse": {
            "@type": "Person",
            "name": "Julia Dahl",
            "jobTitle": "Gymnastics Director"
        },
        "jobTitle": "Manufacturer",
        "worksFor": {
            "@type": "Organization",
            "name": "Marks Textilfabr"
        },
        "education": [
            {
                "@type": "Organization",
                "name": "Technical Weaving School of Borås",
                "startDate": "1898"
            }
        ],
        "affiliation": [
            {
                "@type": "Organization",
                "name": "Sv Jaquard-väveriet",
                "startDate": "1899",
                "endDate": "1907",
                "location": "Halmstad"
            },
            {
                "@type": "Organization",
                "name": "Harpebols Jacquardväv",
                "startDate": "1900",
                "endDate": "1907",
                "location": "Kinna"
            },
            {
                "@type": "Organization",
                "name": "Marks Textilfabr",
                "startDate": "1908",
                "location": "Kinna"
            },
            {
                "@type": "Organization",
                "name": "N Marks Egnahems AB",
                "location": "Kinna"
            }
        ],
        "awaitsTender": {
            "@type": "Organization",
            "name": "Kinna Ändagården"
        },
        "holdsPosition": [
            {
                "@type": "Organization",
                "name": "Kinna Building Committee",
                "roleName": "Chairman"
            },
            {
                "@type": "Organization",
                "name": "Municipal Board",
                "roleName": "Vice Chairman"
            },
            {
                "@type": "Organization",
                "name": "Church Council",
                "roleName": "Member"
            },
            {
                "@type": "Organization",
                "name": "Municipal Board",
                "roleName": "Member"
            },
            {
                "@type": "Organization",
                "name": "Child Welfare Committee",
                "roleName": "Member"
            },
            {
                "@type": "Organization",
                "name": "N Marks Egnahems AB",
                "roleName": "Board Member"
            }
        ],
        "travelRoute": [
            "Germany",
            "Austria",
            "France",
            "Switzerland",
            "Belgium",
            "Netherlands",
            "Italy",
            "Czechoslovakia",
            "Hungary",
            "Yugoslavia",
            "Bulgaria",
            "Romania",
            "England",
            "Spain",
            "Canary Islands",
            "Portugal",
            "Madeira",
            "Egypt",
            "Libya",
            "Tunisia",
            "Algeria",
            "Morocco",
            "Palestine",
            "Syria",
            "Norway",
            "Denmark",
            "Finland"
        ],
        "interest": "Travelling",
        "membership": [
            {
                "@type": "Organization",
                "name": "Odd Fellow"
            }
        ]
    },
    "occupations": {
        "career": [
            {
                "occupational_title": "Fabrikör",
                "workplace": "Marks Textilfabr",
                "industry": "Textile industry",
                "start_date": "1908"
            },
            {
                "occupational_title": "Verkm",
                "workplace": "Sv Jaquard-väveriet",
                "industry": "Textile industry",
                "start_date": "1899"
            },
            {
                "occupational_title": "Harpebols Jacquardväv",
                "workplace": "Harpebols Jacquardväv",
                "industry": "Textile industry",
                "start_date": "1900"
            }
        ]
    }
}