{
    "original": "LINDHOLM, Erik Vilhelm, Ingenjör, Stockholm, f Eskilstuna 6/9 87 av syssloman E A L o Hilda Lund, gm Signhild Boström. Tekn sk. Prakt v mek verkstäder. Anst v ASEA:s ritkont i Västerås 07, AB Enkps Verkstäders ritkont o verkst 08—12, avd.chef f maskin- o verktygsavd h AB Rylander &amp; Asplund i Sthlm 12—21, vkst dir i AB Servus i Sthlm sed. 21. Rest i Europa o USA.",
    "translated": "LINDHOLM, Erik Vilhelm, Engineer, Stockholm, born in Eskilstuna on September 6, 1887, to civil servant E.A.L. and Hilda Lund, married to Signhild Boström. Technical school. Practical experience in mechanical workshops. Employed at ASEA's drafting office in Västerås in 1907, AB Enkps Workshop's drafting office and workshop from 1908 to 1912, department manager for the machine and tool department at AB Rylander & Asplund in Stockholm from 1912 to 1921, director of development at AB Servus in Stockholm since 1921. Traveled in Europe and USA.",
    "structured": {
        "name": "Erik Vilhelm Lindholm",
        "jobTitle": "Engineer",
        "birthDate": "1887-09-06",
        "birthPlace": "Eskilstuna",
        "address": {
            "addressLocality": "Stockholm"
        },
        "parents": [
            {
                "name": "E.A.L. Lund"
            },
            {
                "name": "Hilda Lund"
            }
        ],
        "spouse": {
            "name": "Signhild Boström"
        },
        "education": {
            "name": "Technical school"
        },
        "work": [
            {
                "employer": {
                    "name": "ASEA"
                },
                "startDate": "1907",
                "endDate": "unknown",
                "jobTitle": "Draftsman",
                "location": {
                    "name": "Västerås"
                }
            },
            {
                "employer": {
                    "name": "AB Enkps Workshop"
                },
                "startDate": "1908",
                "endDate": "1912",
                "jobTitle": "Draftsman",
                "location": {
                    "name": "unknown"
                }
            },
            {
                "employer": {
                    "name": "AB Rylander & Asplund"
                },
                "startDate": "1912",
                "endDate": "1921",
                "jobTitle": "Department Manager (Machine and Tool Department)",
                "location": {
                    "name": "Stockholm"
                }
            },
            {
                "employer": {
                    "name": "AB Servus"
                },
                "startDate": "1921",
                "endDate": "unknown",
                "jobTitle": "Director of Development",
                "location": {
                    "name": "Stockholm"
                }
            }
        ],
        "nationality": "Swedish",
        "description": "Erik Vilhelm Lindholm was a Swedish engineer from Stockholm. He was born in Eskilstuna on September 6, 1887, to civil servant E.A.L. and Hilda Lund. Erik was married to Signhild Boström. He attended technical school and gained practical experience in mechanical workshops. Erik started his career as a draftsman at ASEA's drafting office in Västerås in 1907. He then worked at AB Enkps Workshop's drafting office and workshop from 1908 to 1912. From 1912 to 1921, Erik held the position of Department Manager for the Machine and Tool Department at AB Rylander & Asplund in Stockholm. Since 1921, he served as the Director of Development at AB Servus in Stockholm. Throughout his career, he traveled extensively in Europe and the USA."
    },
    "occupations": {
        "career": [
            {
                "occupational_title": "Engineer",
                "workplace": "ASEA's drafting office",
                "industry": "Electrical engineering",
                "start_date": "1907"
            },
            {
                "occupational_title": "Engineer",
                "workplace": "AB Enkps Workshop's drafting office and workshop",
                "industry": "Mechanical engineering",
                "start_date": "1908"
            },
            {
                "occupational_title": "Department Manager",
                "workplace": "AB Rylander & Asplund",
                "industry": "Machine and tool",
                "start_date": "1912"
            },
            {
                "occupational_title": "Director of Development",
                "workplace": "AB Servus",
                "industry": "Unknown",
                "start_date": "1921"
            }
        ]
    }
}